{
  "$schema": "http://json-schema.org/draft-07/schema#",
  "title": "Environment Variables Catalog",
  "description": "A catalog of environment variables used in code",
  "type": "array",
  "items": {
    "type": "object",
    "required": [
      "name",
      "default_value",
      "has_default",
      "packages",
      "tags",
      "locations"
    ],
    "properties": {
      "name": {
        "type": "string",
        "description": "The name of the environment variable"
      },
      "has_default": {
        "type": "boolean",
        "description": "Whether a default value is provided in code"
      },
      "default_value": {
        "type": [
          "string",
          "number",
          "boolean",
          "null"
        ],
        "description": "The default value if provided, or null if not provided"
      },
      "packages": {
        "type": "array",
        "description": "The packages that use this environment variable",
        "items": {
          "type": "string"
        }
      },
      "tags": {
        "type": "array",
        "description": "Tags associated with this environment variable based on base directory structure",
        "items": {
          "type": "string"
        }
      },
      "inferred_type": {
        "type": "string",
        "description": "A string representation of the python type if found"
      },
      "locations": {
        "type": "array",
        "description": "The locations where this environment variable is used",
        "items": {
          "type": "object",
          "required": [
            "file",
            "line"
          ],
          "properties": {
            "file": {
              "type": "string",
              "description": "Relative path to the file"
            },
            "line": {
              "type": "integer",
              "description": "Line number in the file"
            }
          }
        }
      }
    }
  }
}